{
  "$schema": "https://json-schema.org/draft/2020-12/schema",
  "$id": "https://jemu64.local/schemas/iec_profile.schema.json",
  "title": "Jemu64 IEC Physical Profile",
  "type": "object",
  "required": ["profile_id", "line", "model_mode"],
  "properties": {
    "profile_id": { "type": "string", "minLength": 1 },
    "base": { "type": "string" },
    "model_mode": {
      "type": "string",
      "enum": ["fast", "strict", "physical-l6"]
    },
    "line": {
      "type": "object",
      "required": ["atn", "clk", "data"],
      "properties": {
        "atn": {
          "type": "object",
          "required": ["release_delay_ticks", "min_low_pulse_ticks"],
          "properties": {
            "release_delay_ticks": { "type": "integer", "minimum": 0 },
            "min_low_pulse_ticks": { "type": "integer", "minimum": 0 }
          }
        },
        "clk": {
          "type": "object",
          "required": ["release_delay_ticks", "min_low_pulse_ticks"],
          "properties": {
            "release_delay_ticks": { "type": "integer", "minimum": 0 },
            "min_low_pulse_ticks": { "type": "integer", "minimum": 0 }
          }
        },
        "data": {
          "type": "object",
          "required": ["release_delay_ticks", "min_low_pulse_ticks"],
          "properties": {
            "release_delay_ticks": { "type": "integer", "minimum": 0 },
            "min_low_pulse_ticks": { "type": "integer", "minimum": 0 }
          }
        }
      },
      "additionalProperties": true
    },
    "timing": {
      "type": "object",
      "properties": {
        "controller_bit_hold_ticks": { "type": "integer", "minimum": 0 },
        "device_bit_hold_ticks": { "type": "integer", "minimum": 0 },
        "controller_between_bytes_ticks": { "type": "integer", "minimum": 0 },
        "device_between_bytes_ticks": { "type": "integer", "minimum": 0 },
        "atn_response_timeout_ticks": { "type": "integer", "minimum": 0 },
        "device_not_present_timeout_ticks": { "type": "integer", "minimum": 0 },
        "sender_timeout_ticks": { "type": "integer", "minimum": 0 },
        "receiver_timeout_ticks": { "type": "integer", "minimum": 0 },
        "eoi_signal_min_ticks": { "type": "integer", "minimum": 0 },
        "eoi_signal_max_ticks": { "type": "integer", "minimum": 0 },
        "empty_stream_timeout_ticks": { "type": "integer", "minimum": 0 }
      }
    },
    "rx": {
      "type": "object",
      "properties": {
        "setup_ticks": { "type": "integer", "minimum": 0 },
        "hold_ticks": { "type": "integer", "minimum": 0 }
      }
    },
    "timeout": {
      "type": "object",
      "properties": {
        "hysteresis_ticks": { "type": "integer", "minimum": 0 }
      }
    },
    "analog": {
      "type": "object",
      "properties": {
        "enabled": { "type": "boolean" },
        "vdd_milli": { "type": "integer", "minimum": 1 },
        "rise_threshold_milli": { "type": "integer", "minimum": 0 },
        "fall_threshold_milli": { "type": "integer", "minimum": 0 },
        "rise_tau_ticks": { "type": "integer", "minimum": 1 },
        "fall_tau_ticks": { "type": "integer", "minimum": 1 },
        "node": {
          "type": "object",
          "properties": {
            "host": {
              "type": "object",
              "properties": {
                "skew_ticks": { "type": "integer", "minimum": 0 },
                "rise_tau_ticks": { "type": "integer", "minimum": 1 },
                "fall_tau_ticks": { "type": "integer", "minimum": 1 }
              }
            },
            "drive": {
              "type": "object",
              "properties": {
                "skew_ticks": { "type": "integer", "minimum": 0 },
                "rise_tau_ticks": { "type": "integer", "minimum": 1 },
                "fall_tau_ticks": { "type": "integer", "minimum": 1 }
              }
            }
          }
        }
      }
    }
  }
}
