{
  "profile_id": "baseline_1541",
  "model_mode": "physical-l6",
  "line": {
    "atn": { "release_delay_ticks": 1, "min_low_pulse_ticks": 1 },
    "clk": { "release_delay_ticks": 1, "min_low_pulse_ticks": 2 },
    "data": { "release_delay_ticks": 1, "min_low_pulse_ticks": 2 }
  },
  "rx": {
    "setup_ticks": 1,
    "hold_ticks": 1
  },
  "timeout": {
    "hysteresis_ticks": 16
  },
  "analog": {
    "enabled": true,
    "vdd_milli": 1000,
    "rise_threshold_milli": 632,
    "fall_threshold_milli": 368,
    "rise_tau_ticks": 2,
    "fall_tau_ticks": 1
  }
}
